set_id,vendor,path,kind,notes
20260527-SQ-1,wl_analysis,raw/20260527-SQ-1_wl_analysis.txt,wl_perframe_16col,full 16-col rich export (~25fps); name-based cols velocity/displacement/acceleration (vertical); ROM from displacement; peak_accel added; 'Weight(lbs)' is really kg; Time(s) truncates >10s so time rebuilt from frame#; 10 concentrics
20260529-DL-1,wl_analysis,raw/20260529-DL-1_wl_analysis.txt,wl_perframe_16col,full 16-col rich export; deadlift dropped each rep so floor-bounce spikes rejected by ROM filter; ROM from displacement; peak_accel added; 8 concentrics
20260529-DL-3,wl_analysis,raw/20260529-DL-3_wl_analysis.txt,wl_perframe_16col,"full 16-col rich export; 285lb 2nd back-off, dead-stop w/ long pauses; ROM from displacement; peak_accel added; 8 concentrics"
20260528-IB-1,wl_analysis,raw/20260528-IB-1_wl_analysis.txt,wl_perframe_16col,full 16-col rich export; incline bench; ROM from displacement; peak_accel; 10 concentrics; uploaded as Ib285.csv but header 83.9kg confirms it's the 185lb set
20260424-BN-1,wl_analysis,raw/20260424-BN-1_wl_analysis.txt,wl_perframe_16col,"take2: MANUAL circle placement (drawn tight to the plate; standard 45cm diameter KEPT - toggling it off reverted without a cm value) fixed the non-round-plate failure -> weight cal correct (111kg), spurious spike gone, velocities track SmartBarbell. Still 5/6 reps (early touch-and-go merge at 24fps) -> ingested flagged undercount, true_rep unresolved"
20260602-BN-2,vitruve,raw/20260602-BN_vitruve.csv,vitruve_csv,"Vitruve full export; this set = CSV '# Set'=1; 45 cols incl MPV, time-to-peak, force, fatigue%"
20260602-BN-3,vitruve,raw/20260602-BN_vitruve.csv,vitruve_csv,Vitruve full export; this set = CSV '# Set'=2 (fast-TnG challenge set)
